{
  "schema": "sourcefold.weapon.v0",
  "id": "coc:weapon:lightning-gun-model-b",
  "kind": "weapon",
  "name": {
    "ru": "Молниемёт «модель B»",
    "en": "Lightning Gun: Model B"
  },
  "aliases": [
    "Молниемёт"
  ],
  "group": "other",
  "skill": {
    "raw": "Стрельба (молниемёт «модель B»)",
    "skill": "coc:skill:firearms",
    "specialization": "Молниемёт «модель B»"
  },
  "damage": {
    "raw": "2d8 за заряд",
    "dice": "2d8",
    "db": "none",
    "impaling": true
  },
  "range": "100 метров",
  "attacks": "1",
  "ammo": "1d20+3 заряда",
  "malfunction": "каждый заряд сверх четырёх в одном выстреле — накопительно 5% сжечь оружие",
  "cost": {
    "1920s": null,
    "modern": null
  },
  "description": {
    "ru": "Йитианское оружие: на вид — фотоаппарат с объективом и мехами на корпусе с наростами, около 60×30 см; «объектив и мехи» складываются в несущую раму. Успешная проверка ИНТ показывает, что это оружие и опыты с ним опасны; при попытке применить его без знаний — групповая проверка Удачи, при провале луч (2d8) бьёт стрелка или товарища рядом. Держит 1d20+3 встроенных зарядов, перезарядить его сыщики не могут (Хранитель заранее тайно определяет число зарядов у каждого экземпляра). Стреляют двумя руками, один выстрел за раунд; базовый шанс человека 25%, навык «Стрельба (молниемёт «модель B»)». Можно выпустить несколько зарядов разом: каждый заряд сверх четырёх даёт накопительный шанс 5% сжечь оружие (отдельный бросок; при семи зарядах — 15 или меньше). Каждый заряд — 2d8 электрического урона, урон пронзающий, как у огнестрельного оружия. Базовая дальность 100 метров; за каждые следующие 100 метров — штрафная кость (до двух) и −3 к результату урона; в упор — бонусная кость. Без зарядов годится только как дубинка.",
    "en": null
  },
  "model_of": null,
  "caliber": null,
  "reload": null,
  "availability": "Мифы (Великая раса Йит)",
  "axes": {
    "era": [
      "1920s"
    ],
    "ruleset": "core"
  },
  "sources": [
    {
      "book_id": "masks-of-nyarlathotep-en",
      "physical_page": 498,
      "printed_page": 495,
      "method": "book_text",
      "verified": true,
      "note": "Врезка «Lightning Gun: Model B», гл. «Австралия»."
    },
    {
      "book_id": "masks-of-nyarlathotep-en",
      "physical_page": 501,
      "printed_page": 498,
      "method": "book_text",
      "verified": true,
      "note": "Без зарядов молниемёт бесполезен, разве что как дубинка."
    }
  ],
  "corrections": [],
  "errata": [],
  "quality": {
    "needs_review": false,
    "flags": [
      "translated"
    ],
    "notes": "Правила — из врезки «Масок» (англ.); дальность в ярдах переведена в метры 1 к 1 (Р-64). Позиции в таблице XVII нет. «Маски» ссылаются на описание молниемёта у Великой расы в «Книге хранителя»; модель A из Malleus — отдельная запись."
  }
}
