{
  "schema": "sourcefold.weapon.v0",
  "id": "coc:weapon:unarmed",
  "kind": "weapon",
  "name": {
    "ru": "Без оружия",
    "en": "Unarmed"
  },
  "aliases": [],
  "group": "melee",
  "skill": {
    "raw": "Ближний бой (драка)",
    "skill": "coc:skill:fighting",
    "specialization": "Драка"
  },
  "damage": {
    "raw": "1d3+БкУ",
    "dice": "1d3",
    "db": "full",
    "impaling": false
  },
  "range": "Касание",
  "attacks": "1",
  "ammo": null,
  "malfunction": null,
  "cost": {
    "1920s": null,
    "modern": null
  },
  "description": {
    "ru": "Удар кулаком, ногой, головой и т. п.: 1d3 урона плюс бонус к урону; навык Ближний бой (драка).",
    "en": null
  },
  "availability": null,
  "axes": {
    "era": [
      "any"
    ],
    "ruleset": "core"
  },
  "sources": [
    {
      "book_id": "keeper-rulebook-ru",
      "physical_page": 94,
      "printed_page": 101,
      "method": "book_text",
      "verified": true,
      "note": "Не строка таблицы XVII: правило «Определение урона», гл. 6 «Бой»."
    },
    {
      "book_id": "keeper-rulebook-en",
      "physical_page": 105,
      "printed_page": 104,
      "method": "book_text",
      "verified": true,
      "note": "«1D3 for an unarmed human attack», гл. 6."
    }
  ],
  "corrections": [],
  "errata": [],
  "quality": {
    "needs_review": false,
    "flags": [],
    "notes": "Позиции «Без оружия» нет в таблице XVII; урон 1d3 — из гл. 6, бонус к урону добавляется (пример со Стариком Бёрчем, стр. 103)."
  }
}
