{
  "schema": "sourcefold.weapon.v0",
  "id": "coc:weapon:fn-fal",
  "kind": "weapon",
  "name": {
    "ru": "Винтовка автоматическая «ФН» FAL",
    "en": "FN FAL Light Automatic"
  },
  "aliases": [
    "FN FAL"
  ],
  "group": "automatic",
  "skill": {
    "raw": "Стрельба (В/Д)",
    "skill": "coc:skill:firearms",
    "specialization": "Винтовка/дробовик"
  },
  "damage": {
    "raw": "2d6+4",
    "dice": "2d6+4",
    "db": "none",
    "impaling": true
  },
  "range": "110 метров",
  "attacks": "1 (2) или очередями по 3",
  "ammo": "20",
  "malfunction": "97",
  "cost": {
    "1920s": null,
    "modern": "$1500"
  },
  "caliber": "7,62×51 мм НАТО",
  "availability": "Наши дни",
  "description": {
    "ru": "Бельгийская автоматическая винтовка калибра 7,62 мм; стреляет одиночными или очередями по 3. Одиночные выстрелы — навык Стрельба (винтовка/дробовик), очереди и непрерывный огонь — Стрельба (пистолет-пулемёт) по правилам автоматической стрельбы. Обычно не продаётся гражданским; цена — чёрного рынка.",
    "en": null
  },
  "axes": {
    "era": [
      "modern"
    ],
    "ruleset": "core"
  },
  "sources": [
    {
      "book_id": "keeper-rulebook-ru",
      "physical_page": 377,
      "printed_page": 401,
      "method": "book_text",
      "verified": true,
      "note": "Таблица XVII «Оружие»; примечания к таблице — физ. 380 (с. 404)."
    },
    {
      "book_id": "keeper-rulebook-en",
      "physical_page": 405,
      "printed_page": 404,
      "method": "book_text",
      "verified": true,
      "note": "Weapons table (английские названия, сверка)."
    }
  ],
  "corrections": [
    {
      "field": "attacks",
      "from": "1 (2)",
      "to": "1 (2) или очередями по 3",
      "reason": "таблица XVII, стр. 401",
      "ref": "«Книга хранителя», таблица XVII «Оружие», с. 401 (физ. 377)"
    }
  ],
  "quality": {
    "needs_review": false,
    "notes": "Калибр — справочно, не из книги (Р-63)."
  }
}
