{
  "schema": "sourcefold.weapon.v0",
  "id": "coc:weapon:spear-cavalry-lance",
  "kind": "weapon",
  "name": {
    "ru": "Копьё кавалерийское",
    "en": "Spear (cavalry lance)"
  },
  "aliases": [],
  "group": "melee",
  "skill": {
    "raw": "Ближний бой (копьё)",
    "skill": "coc:skill:fighting",
    "specialization": "Копьё"
  },
  "damage": {
    "raw": "1d8+1",
    "dice": "1d8+1",
    "db": "none",
    "impaling": true
  },
  "range": "Касание",
  "attacks": "1",
  "ammo": null,
  "malfunction": null,
  "cost": {
    "1920s": "$25",
    "modern": "$150"
  },
  "description": {
    "ru": "Кавалерийское копьё (пика).",
    "en": null
  },
  "availability": "1920-е, наши дни",
  "axes": {
    "era": [
      "1920s",
      "modern"
    ],
    "ruleset": "core"
  },
  "sources": [
    {
      "book_id": "keeper-rulebook-ru",
      "physical_page": 375,
      "printed_page": 399,
      "method": "book_text",
      "verified": true,
      "note": "Таблица XVII «Оружие», гл. 16; числа сверены по изображению страницы."
    },
    {
      "book_id": "keeper-rulebook-en",
      "physical_page": 402,
      "printed_page": 401,
      "method": "book_text",
      "verified": true,
      "note": "Table XVII: Weapon Lists — английское название, сверка."
    }
  ],
  "corrections": [],
  "errata": [],
  "quality": {
    "needs_review": false,
    "flags": [],
    "notes": "Англ. таблица: «Spear (cavalry lance)*» без пометки (i), со звёздочкой без примечания; рус. — «(пр)» без звёздочки."
  }
}
