{
  "schema": "sourcefold.weapon.v0",
  "id": "coc:weapon:spear-thrown",
  "kind": "weapon",
  "name": {
    "ru": "Копьё метательное",
    "en": "Spear, Thrown"
  },
  "aliases": [],
  "group": "melee",
  "skill": {
    "raw": "Метание",
    "skill": "coc:skill:throw",
    "specialization": null
  },
  "damage": {
    "raw": "1d8+1/2 БкУ",
    "dice": "1d8",
    "db": "half",
    "impaling": true
  },
  "range": "СИЛ / 5 метров",
  "attacks": "1",
  "ammo": null,
  "malfunction": null,
  "cost": {
    "1920s": "$1",
    "modern": "$25"
  },
  "description": {
    "ru": "Метательное копьё или дротик.",
    "en": null
  },
  "availability": "Редкое",
  "axes": {
    "era": [
      "1920s",
      "modern"
    ],
    "ruleset": "core"
  },
  "sources": [
    {
      "book_id": "keeper-rulebook-ru",
      "physical_page": 375,
      "printed_page": 399,
      "method": "book_text",
      "verified": true,
      "note": "Таблица XVII «Оружие», гл. 16; числа сверены по изображению страницы."
    },
    {
      "book_id": "keeper-rulebook-en",
      "physical_page": 402,
      "printed_page": 401,
      "method": "book_text",
      "verified": true,
      "note": "Table XVII: Weapon Lists — английское название, сверка."
    }
  ],
  "corrections": [],
  "errata": [],
  "quality": {
    "needs_review": false,
    "flags": [],
    "notes": "Англ. таблица: дальность STR yards; рус. — «СИЛ / 5 метров»."
  }
}
