{
  "schema": "sourcefold.weapon.v0",
  "id": "coc:weapon:auto-ordnance-model-1921-thompson",
  "kind": "weapon",
  "name": {
    "ru": "Auto-Ordnance Model 1921 Thompson",
    "en": "Auto-Ordnance Model 1921 Thompson"
  },
  "aliases": [],
  "group": "automatic",
  "skill": {
    "raw": "Стрельба (Пистолет-пулемёт)",
    "skill": "coc:skill:firearms",
    "specialization": "Пистолет-пулемёт"
  },
  "damage": {
    "raw": "1d10+2",
    "dice": "1d10+2",
    "db": "none",
    "impaling": true
  },
  "range": "40/80 метров",
  "attacks": "1/30 выстрелов в ход",
  "ammo": "20/50/100 патронов",
  "malfunction": "96",
  "cost": {
    "1920s": "225$+2.5/21/25$(магазин)",
    "modern": null
  },
  "description": {
    "ru": "Пистолет-пулемёт Томпсона первой коммерческой модели 1921 года под .45 ACP с коробчатыми и барабанными магазинами. С 1934 года обычно доступен только армии и ведомствам; возможны сошки.",
    "en": null
  },
  "model_of": "coc:weapon:thompson-smg",
  "caliber": ".45 ACP (11.43x23mm)",
  "reload": "1 ход",
  "availability": null,
  "axes": {
    "era": [
      "1920s"
    ],
    "ruleset": "core"
  },
  "sources": [
    {
      "book_id": "weapons-catalog-1920s",
      "physical_page": null,
      "printed_page": null,
      "method": "helper_migration",
      "verified": false,
      "note": "пользовательский каталог «Оружие (лучше скачивать).docx» из веб-помощника — не книга"
    }
  ],
  "corrections": [],
  "errata": [],
  "quality": {
    "needs_review": false,
    "flags": [
      "editorial_text"
    ],
    "notes": "Источник — пользовательский каталог, не книга (Р-58). По таблице XVII: дальность 20 метров, атак 1 или непр. огонь, боезапас 20/30/50, цена от $200."
  }
}
