{
  "schema": "sourcefold.weapon.v0",
  "id": "coc:weapon:skorpion-smg",
  "kind": "weapon",
  "name": {
    "ru": "Пистолет-пулемёт «Скорпион»",
    "en": "Skorpion SMG"
  },
  "aliases": [
    "ПП «Скорпион»"
  ],
  "group": "automatic",
  "skill": {
    "raw": "Стрельба (ППМ)",
    "skill": "coc:skill:firearms",
    "specialization": "Пистолет-пулемёт"
  },
  "damage": {
    "raw": "1d8",
    "dice": "1d8",
    "db": "none",
    "impaling": true
  },
  "range": "15 метров",
  "attacks": "1 (3) или непр. огонь",
  "ammo": "20",
  "malfunction": "96",
  "cost": {
    "1920s": "Нет",
    "modern": "Нет"
  },
  "caliber": ".32 ACP (7,65×17 мм)",
  "availability": "Наши дни",
  "description": {
    "ru": "Компактный чехословацкий пистолет-пулемёт. Очереди и непрерывный огонь — по правилам автоматической стрельбы. Обычно не продаётся гражданским; цена — чёрного рынка.",
    "en": null
  },
  "axes": {
    "era": [
      "modern"
    ],
    "ruleset": "core"
  },
  "sources": [
    {
      "book_id": "keeper-rulebook-ru",
      "physical_page": 378,
      "printed_page": 402,
      "method": "book_text",
      "verified": true,
      "note": "Таблица XVII «Оружие»; примечания к таблице — физ. 380 (с. 404)."
    },
    {
      "book_id": "keeper-rulebook-en",
      "physical_page": 405,
      "printed_page": 404,
      "method": "book_text",
      "verified": true,
      "note": "Weapons table (английские названия, сверка)."
    }
  ],
  "quality": {
    "needs_review": false,
    "notes": "Калибр — справочно, не из книги (Р-63)."
  }
}
