{
  "schema": "sourcefold.weapon.v0",
  "id": "coc:weapon:thompson-smg",
  "kind": "weapon",
  "name": {
    "ru": "ПП Томпсона",
    "en": "Thompson"
  },
  "aliases": [],
  "group": "automatic",
  "skill": {
    "raw": "Стрельба (ППМ)",
    "skill": "coc:skill:firearms",
    "specialization": "Пистолет-пулемёт"
  },
  "damage": {
    "raw": "1d10+2",
    "dice": "1d10+2",
    "db": "none",
    "impaling": true
  },
  "range": "20 метров",
  "attacks": "1 или непр. огонь",
  "ammo": "20/30/50",
  "malfunction": "96",
  "cost": {
    "1920s": "от $200",
    "modern": "$1600"
  },
  "availability": "1920-е",
  "description": {
    "ru": "Пистолет-пулемёт Томпсона («томми-ган») — оружие гангстеров и полиции 1920-х; магазины на 20 или 30 патронов, барабан на 50. Очереди и непрерывный огонь — по правилам автоматической стрельбы. Обычно не продаётся гражданским; цена — чёрного рынка.",
    "en": null
  },
  "axes": {
    "era": [
      "1920s"
    ],
    "ruleset": "core"
  },
  "sources": [
    {
      "book_id": "keeper-rulebook-ru",
      "physical_page": 378,
      "printed_page": 402,
      "method": "book_text",
      "verified": true,
      "note": "Таблица XVII «Оружие»; примечания к таблице — физ. 380 (с. 404)."
    },
    {
      "book_id": "keeper-rulebook-en",
      "physical_page": 405,
      "printed_page": 404,
      "method": "book_text",
      "verified": true,
      "note": "Weapons table (английские названия, сверка)."
    }
  ],
  "quality": {
    "needs_review": false,
    "notes": "В английской таблице указана только цена 1920-х; современная цена — по русскому изданию."
  }
}
