{
  "schema": "sourcefold.weapon.v0",
  "id": "coc:weapon:desert-eagle",
  "kind": "weapon",
  "name": {
    "ru": "Пистолет «Дезерт Игл»",
    "en": "IMI Desert Eagle"
  },
  "aliases": [
    "«Дезерт Игл»"
  ],
  "group": "handgun",
  "skill": {
    "raw": "Стрельба (П)",
    "skill": "coc:skill:firearms",
    "specialization": "Пистолет"
  },
  "damage": {
    "raw": "1d10+1d6+3",
    "dice": "1d10+1d6+3",
    "db": "none",
    "impaling": true
  },
  "range": "15 метров",
  "attacks": "1 (3)",
  "ammo": "7",
  "malfunction": "94",
  "cost": {
    "1920s": null,
    "modern": "$650"
  },
  "description": {
    "ru": "Если стрелять из пистолета более одного раза за раунд, все выстрелы совершаются с одной штрафной костью; число в скобках — максимум выстрелов за раунд.",
    "en": null
  },
  "caliber": ".50 AE (12,7×33 мм)",
  "availability": "Наши дни",
  "axes": {
    "era": [
      "modern"
    ],
    "ruleset": "core"
  },
  "sources": [
    {
      "book_id": "keeper-rulebook-ru",
      "physical_page": 376,
      "printed_page": 400,
      "method": "book_text",
      "verified": true,
      "note": "Таблица XVII «Оружие», гл. 16; числа сверены по изображению страницы."
    },
    {
      "book_id": "keeper-rulebook-en",
      "physical_page": 403,
      "printed_page": 402,
      "method": "book_text",
      "verified": true,
      "note": "Table XVII: Weapon Lists — английское название, сверка."
    }
  ],
  "corrections": [],
  "errata": [],
  "quality": {
    "needs_review": false,
    "flags": [],
    "notes": "Калибр — справочно, не из книги (Р-63)."
  }
}
