{
  "schema": "sourcefold.weapon.v0",
  "id": "coc:weapon:winchester-model-97-trenchgun",
  "kind": "weapon",
  "name": {
    "ru": "Winchester Model 97 Trenchgun",
    "en": "Winchester Model 97 Trenchgun"
  },
  "aliases": [],
  "group": "shotgun",
  "skill": {
    "raw": "Стрельба (Винтовка / Дробовик)",
    "skill": "coc:skill:firearms",
    "specialization": "Винтовка/дробовик"
  },
  "damage": {
    "raw": "4d6/2d6/1d6 (1d10+6 Slug)",
    "dice": null,
    "db": "none",
    "impaling": false
  },
  "range": "7/15/35 метров",
  "attacks": "1 выстрел в ход",
  "ammo": "5+1 патрон",
  "malfunction": "100",
  "cost": {
    "1920s": "50$",
    "modern": null
  },
  "description": {
    "ru": "Армейский «окопный» вариант Winchester Model 1897 с укороченным стволом, кожухом и креплением для штыка; применялся в Первую мировую и силовыми ведомствами. Перед стрельбой нужен 1 ход подготовки.",
    "en": null
  },
  "model_of": "coc:weapon:shotgun-12-gauge-pump",
  "caliber": "12G 2.75” (18.5x70mmR)",
  "reload": "3 хода",
  "availability": "1920-е",
  "axes": {
    "era": [
      "1920s"
    ],
    "ruleset": "core"
  },
  "sources": [
    {
      "book_id": "weapons-catalog-1920s",
      "physical_page": null,
      "printed_page": null,
      "method": "helper_migration",
      "verified": false,
      "note": "пользовательский каталог «Оружие (лучше скачивать).docx» из веб-помощника — не книга"
    }
  ],
  "corrections": [],
  "errata": [],
  "quality": {
    "needs_review": false,
    "flags": [
      "editorial_text"
    ],
    "notes": "Источник — пользовательский каталог, не книга (Р-58). По таблице XVII: дальность 10/20/50 метров, цена $45. damage.dice не заполнено: урон зависит от дальности."
  }
}
