{
  "schema": "sourcefold.weapon.v0",
  "id": "coc:weapon:8mm-automatic",
  "kind": "weapon",
  "name": {
    "ru": "Пистолет автоматический 8 мм",
    "en": "8mm automatic pistol"
  },
  "aliases": [
    "Автоматический пистолет 8 мм"
  ],
  "group": "handgun",
  "skill": {
    "raw": "Стрельба (пистолет)",
    "skill": "coc:skill:firearms",
    "specialization": "Пистолет"
  },
  "damage": {
    "raw": "1d8",
    "dice": "1d8",
    "db": "none",
    "impaling": true
  },
  "range": null,
  "attacks": null,
  "ammo": null,
  "malfunction": null,
  "cost": {
    "1920s": null,
    "modern": null
  },
  "description": {
    "ru": "Пистолет японского агента Исогэ Таро (Шанхай); вероятно, армейский «Намбу».",
    "en": null
  },
  "model_of": "coc:weapon:32-automatic",
  "caliber": "8 мм (8×22 мм «Намбу»)",
  "reload": null,
  "availability": "1920-е, Япония",
  "axes": {
    "era": [
      "1920s"
    ],
    "ruleset": "core"
  },
  "sources": [
    {
      "book_id": "masks-of-nyarlathotep-en",
      "physical_page": 605,
      "printed_page": 602,
      "method": "book_text",
      "verified": true,
      "note": "Исогэ Таро: 8mm automatic pistol 55% (27/11), damage 1D8."
    }
  ],
  "corrections": [],
  "errata": [],
  "quality": {
    "needs_review": false,
    "flags": [
      "translated"
    ],
    "notes": "В «Масках» (англ.) напечатан только урон; дальность, атаки, боезапас и осечка не указаны. Калибр «8 мм» — из книги; патрон 8×22 мм «Намбу» и модель — справочно, не из книги (Р-63). В таблице XVII такого пистолета нет; ближайшая позиция — пистолет автоматический .32 (7,65 мм), тот же урон 1d8."
  }
}
