{
  "schema": "sourcefold.weapon.v0",
  "id": "coc:weapon:knife-small",
  "kind": "weapon",
  "name": {
    "ru": "Нож маленький (выкидной и т. п.)",
    "en": "Knife, Small (switchblade, etc.)"
  },
  "aliases": [],
  "group": "melee",
  "skill": {
    "raw": "Ближний бой (драка)",
    "skill": "coc:skill:fighting",
    "specialization": "Драка"
  },
  "damage": {
    "raw": "1d4+БкУ",
    "dice": "1d4",
    "db": "full",
    "impaling": true
  },
  "range": "Касание",
  "attacks": "1",
  "ammo": null,
  "malfunction": null,
  "cost": {
    "1920s": "$2",
    "modern": "$6"
  },
  "description": {
    "ru": "Маленький нож: выкидной, перочинный.",
    "en": null
  },
  "availability": "1920-е, наши дни",
  "axes": {
    "era": [
      "1920s",
      "modern"
    ],
    "ruleset": "core"
  },
  "sources": [
    {
      "book_id": "keeper-rulebook-ru",
      "physical_page": 375,
      "printed_page": 399,
      "method": "book_text",
      "verified": true,
      "note": "Таблица XVII «Оружие», гл. 16; числа сверены по изображению страницы."
    },
    {
      "book_id": "keeper-rulebook-en",
      "physical_page": 402,
      "printed_page": 401,
      "method": "book_text",
      "verified": true,
      "note": "Table XVII: Weapon Lists — английское название, сверка."
    }
  ],
  "corrections": [],
  "errata": [],
  "quality": {
    "needs_review": false,
    "flags": [],
    "notes": null
  }
}
