{
  "schema": "sourcefold.weapon.v0",
  "id": "coc:weapon:fn-minimi",
  "kind": "weapon",
  "name": {
    "ru": "FN «Миними» калибра 5,56 мм",
    "en": "FN Minimi, 5.56mm"
  },
  "aliases": [],
  "group": "automatic",
  "skill": {
    "raw": "Стрельба (ПМ)",
    "skill": "coc:skill:firearms",
    "specialization": "Пулемёт"
  },
  "damage": {
    "raw": "2d6",
    "dice": "2d6",
    "db": "none",
    "impaling": true
  },
  "range": "110 метров",
  "attacks": "Непр. огонь",
  "ammo": "30/200",
  "malfunction": "99",
  "cost": {
    "1920s": "Нет",
    "modern": "Нет"
  },
  "availability": "Наши дни",
  "description": {
    "ru": "Бельгийский ручной пулемёт калибра 5,56 мм; магазин на 30 патронов или лента на 200; ведёт только непрерывный огонь. Очереди и непрерывный огонь — по правилам автоматической стрельбы. Обычно не продаётся гражданским; цена — чёрного рынка.",
    "en": null
  },
  "axes": {
    "era": [
      "modern"
    ],
    "ruleset": "core"
  },
  "sources": [
    {
      "book_id": "keeper-rulebook-ru",
      "physical_page": 378,
      "printed_page": 402,
      "method": "book_text",
      "verified": true,
      "note": "Таблица XVII «Оружие»; примечания к таблице — физ. 380 (с. 404)."
    },
    {
      "book_id": "keeper-rulebook-en",
      "physical_page": 405,
      "printed_page": 404,
      "method": "book_text",
      "verified": true,
      "note": "Weapons table (английские названия, сверка)."
    }
  ],
  "quality": {
    "needs_review": false
  }
}
