{
  "schema": "sourcefold.weapon.v0",
  "id": "coc:weapon:holland-holland-royal-double",
  "kind": "weapon",
  "name": {
    "ru": "Holland & Holland royal double",
    "en": "Holland & Holland royal double"
  },
  "aliases": [],
  "group": "rifle",
  "skill": {
    "raw": "Стрельба (Винтовка / Дробовик)",
    "skill": "coc:skill:firearms",
    "specialization": "Винтовка/дробовик"
  },
  "damage": {
    "raw": "3d6+2/3d6+3/3d6+4",
    "dice": null,
    "db": "none",
    "impaling": true
  },
  "range": "70 метров",
  "attacks": "1 выстрел в ход",
  "ammo": "2 патрона",
  "malfunction": "100",
  "cost": {
    "1920s": "1200$",
    "modern": null
  },
  "description": {
    "ru": "Штучный двуствольный штуцер Holland & Holland Royal под патроны Nitro Express .470, .577 или .600 (урон через косую черту — по патрону); весит около 7 кг, огромная отдача, делается на заказ.",
    "en": null
  },
  "model_of": "coc:weapon:elephant-gun-2b",
  "caliber": ".470/577/600 Nitro Express",
  "reload": "2 хода",
  "availability": "1920-е",
  "axes": {
    "era": [
      "1920s"
    ],
    "ruleset": "core"
  },
  "sources": [
    {
      "book_id": "weapons-catalog-1920s",
      "physical_page": null,
      "printed_page": null,
      "method": "helper_migration",
      "verified": false,
      "note": "пользовательский каталог «Оружие (лучше скачивать).docx» из веб-помощника — не книга"
    }
  ],
  "corrections": [],
  "errata": [],
  "quality": {
    "needs_review": false,
    "flags": [
      "editorial_text"
    ],
    "notes": "Источник — пользовательский каталог, не книга (Р-58). По таблице XVII: урон 3d6+4, дальность 100 метров, атак 1 или 2, цена $400. damage.dice не заполнено: урон зависит от патрона, см. damage.raw."
  }
}
