{
  "schema": "sourcefold.weapon.v0",
  "id": "coc:weapon:colt-frontier-six-shooter-saa",
  "kind": "weapon",
  "name": {
    "ru": "Colt Frontier Six-Shooter/Colt SAA Civilian",
    "en": "Colt Frontier Six-Shooter/Colt SAA Civilian"
  },
  "aliases": [
    "Colt Frontier Six-Shooter",
    "Colt SAA Civilian"
  ],
  "group": "handgun",
  "skill": {
    "raw": "Стрельба (Пистолет)",
    "skill": "coc:skill:firearms",
    "specialization": "Пистолет"
  },
  "damage": {
    "raw": "1d8+1d6/1d10+2",
    "dice": null,
    "db": "none",
    "impaling": true
  },
  "range": "15 метров",
  "attacks": "1 выстрел в ход",
  "ammo": "6(5) патронов",
  "malfunction": "100",
  "cost": {
    "1920s": "34$+10$ (кастомный вариант)",
    "modern": null
  },
  "description": {
    "ru": "Классический револьвер одинарного действия Colt Single Action Army под .44-40 Winchester или .45 Long Colt (урон через косую черту — по патрону). Предохранителя нет, поэтому одну камору обычно оставляют пустой; заряжается по одному патрону.",
    "en": null
  },
  "model_of": "coc:weapon:45-revolver",
  "caliber": ".44-40 Winchester (10.8x33mmR) / .45 Long Colt (11.43x33mmR)",
  "reload": "6 ходов",
  "availability": "отсутствует предохранитель",
  "axes": {
    "era": [
      "1920s"
    ],
    "ruleset": "core"
  },
  "sources": [
    {
      "book_id": "weapons-catalog-1920s",
      "physical_page": null,
      "printed_page": null,
      "method": "helper_migration",
      "verified": false,
      "note": "пользовательский каталог «Оружие (лучше скачивать).docx» из веб-помощника — не книга"
    }
  ],
  "corrections": [],
  "errata": [],
  "quality": {
    "needs_review": false,
    "flags": [
      "editorial_text"
    ],
    "notes": "Источник — пользовательский каталог, не книга (Р-58). По таблице XVII: урон 1d10+2, атак 1 (3), цена $30. damage.dice не заполнено: урон зависит от патрона (.44-40 / .45 Long Colt), см. damage.raw."
  }
}
