{
  "schema": "sourcefold.weapon.v0",
  "id": "coc:weapon:law",
  "kind": "weapon",
  "name": {
    "ru": "Гранатомёт «M72 LAW»",
    "en": "LAW"
  },
  "aliases": [
    "РПГ"
  ],
  "group": "heavy",
  "skill": {
    "raw": "Стрельба (ТВ)",
    "skill": "coc:skill:firearms",
    "specialization": "Тяжёлое вооружение"
  },
  "damage": {
    "raw": "8d10/1 метр",
    "dice": "8d10",
    "db": "none",
    "impaling": true
  },
  "range": "150 метров",
  "attacks": "1",
  "ammo": "1",
  "malfunction": "98",
  "cost": {
    "1920s": "Нет",
    "modern": "Нет"
  },
  "caliber": "66 мм",
  "availability": "Наши дни",
  "description": {
    "ru": "Ручной противотанковый гранатомёт, одноразовый. Радиус поражения 1 м: до 2 м урон уменьшается вдвое, до 3 м — вчетверо, дальше урон не наносится.",
    "en": null
  },
  "axes": {
    "era": [
      "modern"
    ],
    "ruleset": "core"
  },
  "sources": [
    {
      "book_id": "keeper-rulebook-ru",
      "physical_page": 379,
      "printed_page": 403,
      "method": "book_text",
      "verified": true,
      "note": "Таблица XVII «Оружие»; примечания к таблице — физ. 380 (с. 404)."
    },
    {
      "book_id": "keeper-rulebook-en",
      "physical_page": 406,
      "printed_page": 405,
      "method": "book_text",
      "verified": true,
      "note": "Weapons table (английские названия, сверка)."
    }
  ],
  "corrections": [
    {
      "field": "description.ru",
      "from": "Ручной Противотанковый Гранатомёт, одноразовый. Радиус поражения 1 метр. Если расстояние до цели больше 1 м, но меньше 2, урон уменьшается вдвое; больше 2, но меньше 4 — вчетверо. Если расстояние больше 4, урон не наносится.",
      "to": "Ручной противотанковый гранатомёт, одноразовый. Радиус поражения 1 м: до 2 м урон уменьшается вдвое, до 3 м — вчетверо, дальше урон не наносится.",
      "reason": "таблица XVII, примечание «2 метра, 3 метра и т. д.»: урон вчетверо до 3x, дальше не наносится (в помощнике границы 2x и 4x)",
      "ref": "«Книга хранителя», таблица XVII, примечания, с. 404 (физ. 380)"
    }
  ],
  "quality": {
    "needs_review": false,
    "notes": "Калибр — справочно, не из книги (Р-63)."
  }
}
