{
  "schema": "sourcefold.weapon.v0",
  "id": "coc:weapon:walther-pp",
  "kind": "weapon",
  "name": {
    "ru": "Walther PP",
    "en": "Walther PP"
  },
  "aliases": [],
  "group": "handgun",
  "skill": {
    "raw": "Стрельба (Пистолет)",
    "skill": "coc:skill:firearms",
    "specialization": "Пистолет"
  },
  "damage": {
    "raw": "1d8",
    "dice": "1d8",
    "db": "none",
    "impaling": true
  },
  "range": "15 метров",
  "attacks": "3 выстрела в ход",
  "ammo": "8+1 патрон",
  "malfunction": "99",
  "cost": {
    "1920s": "32$+3.5$ (магазин) + +2$ (люминесцентная мушка)",
    "modern": null
  },
  "description": {
    "ru": "Немецкий полицейский пистолет Walther PP под .32 ACP; за доплату — запасной магазин и люминесцентная мушка.\nWalther PP выпускается с 1929 года — модель конца эпохи.",
    "en": null
  },
  "model_of": "coc:weapon:32-automatic",
  "caliber": ".32 ACP (7.65x17mmSR)",
  "reload": "1 ход",
  "availability": "силовые ведомства Германии, компактный",
  "axes": {
    "era": [
      "1920s"
    ],
    "ruleset": "core"
  },
  "sources": [
    {
      "book_id": "weapons-catalog-1920s",
      "physical_page": null,
      "printed_page": null,
      "method": "helper_migration",
      "verified": false,
      "note": "пользовательский каталог «Оружие (лучше скачивать).docx» из веб-помощника — не книга"
    }
  ],
  "corrections": [],
  "errata": [],
  "quality": {
    "needs_review": false,
    "flags": [
      "editorial_text"
    ],
    "notes": "Источник — пользовательский каталог, не книга (Р-58). По таблице XVII: цена $20."
  }
}
