{
  "schema": "sourcefold.weapon.v0",
  "id": "coc:weapon:webley-revolver",
  "kind": "weapon",
  "name": {
    "ru": "Револьвер «Вебли»",
    "en": "Webley revolver"
  },
  "aliases": [
    "Пистолет «Вебли»"
  ],
  "group": "handgun",
  "skill": {
    "raw": "Стрельба (пистолет)",
    "skill": "coc:skill:firearms",
    "specialization": "Пистолет"
  },
  "damage": {
    "raw": "1d10",
    "dice": "1d10",
    "db": "none",
    "impaling": true
  },
  "range": null,
  "attacks": null,
  "ammo": null,
  "malfunction": null,
  "cost": {
    "1920s": null,
    "modern": null
  },
  "description": {
    "ru": "Британский армейский револьвер; в «Масках Ньярлатхотепа» он у Омара аль-Шакти (Египет) и в оружейном шкафчике на смотровой площадке охотничьего лагеря полковника Эндикотта (Кения).",
    "en": null
  },
  "model_of": "coc:weapon:38-revolver",
  "caliber": ".38/200 (9×20 мм R)",
  "reload": null,
  "availability": "1920-е",
  "axes": {
    "era": [
      "1920s"
    ],
    "ruleset": "core"
  },
  "sources": [
    {
      "book_id": "masks-of-nyarlathotep-en",
      "physical_page": 380,
      "printed_page": 377,
      "method": "book_text",
      "verified": true,
      "note": "Омар аль-Шакти: Webley revolver 35% (17/7), damage 1D10."
    },
    {
      "book_id": "masks-of-nyarlathotep-en",
      "physical_page": 420,
      "printed_page": 417,
      "method": "book_text",
      "verified": true,
      "note": "Смотровая площадка лагеря Эндикотта: «a Webley pistol (damage 1D10)»."
    }
  ],
  "corrections": [],
  "errata": [],
  "quality": {
    "needs_review": false,
    "flags": [
      "translated"
    ],
    "notes": "В «Масках» (англ.) напечатан только урон 1D10; дальность, атаки, боезапас и осечка не указаны. Калибр — справочно, не из книги (Р-63). Урон 1d10 соответствует револьверу .38 таблицы XVII; армейский «Вебли» Mk VI под патрон .455 — отдельная модель каталога (урон 1d10+2)."
  }
}
