{
  "schema": "sourcefold.weapon.v0",
  "id": "coc:weapon:shotgun-20-gauge-2b",
  "kind": "weapon",
  "name": {
    "ru": "Дробовик двуствольный 20-го калибра",
    "en": "20-gauge Shotgun (2B)"
  },
  "aliases": [
    "Дробовик 20-го калибра (с 2 стволами)",
    "Дробовик 20-го калибра (2С)"
  ],
  "group": "shotgun",
  "skill": {
    "raw": "Стрельба (В/Д)",
    "skill": "coc:skill:firearms",
    "specialization": "Винтовка/дробовик"
  },
  "damage": {
    "raw": "2d6/1d6/1d3",
    "dice": null,
    "db": "none",
    "impaling": false
  },
  "range": "10/20/50 метров",
  "attacks": "1 или 2",
  "ammo": "2",
  "malfunction": "100",
  "cost": {
    "1920s": "$35",
    "modern": "редкое"
  },
  "caliber": "20-й калибр",
  "availability": "1920-е",
  "description": {
    "ru": "Двуствольный дробовик 20-го калибра; за раунд можно выстрелить из одного или обоих стволов. Урон зависит от дальности (ближняя/средняя/большая). Дробь не наносит проникающих ран; пулевой патрон 20-го калибра — 1d10+4, базовая дальность 50 м, проникающий. Второй выстрел по той же цели — без штрафной кости, по другой цели — со штрафной.",
    "en": null
  },
  "axes": {
    "era": [
      "1920s"
    ],
    "ruleset": "core"
  },
  "sources": [
    {
      "book_id": "keeper-rulebook-ru",
      "physical_page": 377,
      "printed_page": 401,
      "method": "book_text",
      "verified": true,
      "note": "Таблица XVII «Оружие»; примечания к таблице — физ. 380 (с. 404)."
    },
    {
      "book_id": "keeper-rulebook-en",
      "physical_page": 404,
      "printed_page": 403,
      "method": "book_text",
      "verified": true,
      "note": "Weapons table (английские названия, сверка)."
    }
  ],
  "quality": {
    "needs_review": false,
    "notes": "damage.dice не заполнено: урон зависит от дальности, см. damage.raw."
  }
}
